{
  "contractVersion": "1.0.0",
  "direction": "unity-to-native",
  "sessionId": "6f1c2a8e-3b7d-4c55-9a0e-1d2f4b6c8e10",
  "seq": 0,
  "timestampMs": 1790000001200,
  "type": "ready",
  "payload": {
    "unityVersion": "6000.3.24f1",
    "gameKitVersion": "1.0.0",
    "simulationId": "football.coverage.read.v1",
    "simulationVersion": "1.0.0",
    "supportedContractVersions": ["1.0.0"],
    "loadTimeMs": 1450
  }
}
