{
  "contractVersion": "1.0.0",
  "direction": "native-to-unity",
  "sessionId": "6f1c2a8e-3b7d-4c55-9a0e-1d2f4b6c8e10",
  "seq": 0,
  "timestampMs": 1790000000000,
  "type": "launch",
  "payload": {
    "contractVersion": "1.0.0",
    "sessionId": "6f1c2a8e-3b7d-4c55-9a0e-1d2f4b6c8e10",
    "simulationId": "football.coverage.read.v1",
    "simulationVersion": "1.0.0",
    "courseId": "american-football",
    "unitId": "defense-basics",
    "lessonId": "coverage-04",
    "difficulty": 1,
    "locale": "en-US",
    "configuration": {},
    "learnerContext": {
      "masteredConcepts": [],
      "weakConcepts": [],
      "accessibility": { "reducedMotion": true, "hapticsEnabled": false, "colorBlindMode": "deuteranopia", "textScale": 1.3 }
    },
    "theme": {
      "colorScheme": "light",
      "colors": {
        "bg": "#F7F3EC", "bgDeep": "#EFE9DF", "surface": "#FFFFFF", "surface2": "#EDE7DD",
        "stroke": "#14101614", "strokeStrong": "#14101629", "ink": "#17151A", "ink2": "#4A434C", "ink3": "#6B646E",
        "accent": "#D93F5E", "accentSoft": "#B8324F", "accentTint": "#D93F5E1A", "onAccent": "#FFFFFF",
        "reward": "#A87A1E", "rewardTint": "#A87A1E1A", "court": "#D9E6DF"
      },
      "fonts": { "display": "Instrument Serif", "ui": "Geist" }
    },
    "runtime": { "maxDurationMs": 600000, "heartsRemaining": 3 }
  }
}
