{
  "contractVersion": "1.0.0",
  "direction": "unity-to-native",
  "sessionId": "6f1c2a8e-3b7d-4c55-9a0e-1d2f4b6c8e10",
  "seq": 9,
  "timestampMs": 1790000170000,
  "type": "result",
  "payload": {
    "contractVersion": "1.0.0",
    "sessionId": "6f1c2a8e-3b7d-4c55-9a0e-1d2f4b6c8e10",
    "simulationId": "football.coverage.read.v1",
    "simulationVersion": "1.0.0",
    "completed": false,
    "aborted": true,
    "abortReason": "user-quit",
    "durationMs": 42000,
    "score": 0,
    "accuracy": 0,
    "outcomes": [],
    "mistakes": [],
    "masterySignals": [],
    "xpEarned": 0,
    "heartsLost": 0,
    "replayAvailable": false
  }
}
